Identificação do post,Identificação da conta,Nome de usuário da conta,Nome da conta,Descrição,Duração (s),Horário de publicação,Link permanente,Tipo de post,Comentário de dados,Data,Visualizações,Alcance,Curtidas,Compartilhamentos,Seguimentos,Comentários,Salvamentos
FAKE202603000,17841476283103388,setup.english,SetUp - English School,"Dica rápida de inglês para o dia a dia — como responder e-mails formais com clareza.",,03/15/2026 15:00,https://www.instagram.com/p/FAKE202603000/,Carrossel,,Total,7825,5092,750,151,0,24,109
FAKE202603001,17841476283103388,setup.english,SetUp - English School,"O que você aprende em 30 dias de imersão? Um relato real de um aluno da turma avançada.",,03/25/2026 12:00,https://www.instagram.com/p/FAKE202603001/,Reel,,Total,4257,2713,201,25,0,18,28
FAKE202603002,17841476283103388,setup.english,SetUp - English School,"Vocabulário de negócios: 10 expressões que você pode usar amanhã na reunião.",,03/01/2026 18:00,https://www.instagram.com/p/FAKE202603002/,Post,,Total,8181,6360,673,58,0,10,204
FAKE202603003,17841476283103388,setup.english,SetUp - English School,"Por que seu inglês trava na hora de falar? A resposta está na prática real.",,03/23/2026 18:00,https://www.instagram.com/p/FAKE202603003/,Reel,,Total,1966,1527,242,57,0,21,66
FAKE202603004,17841476283103388,setup.english,SetUp - English School,"Apresentações em inglês: estrutura, postura e confiança. Veja o método que usamos.",,03/26/2026 12:00,https://www.instagram.com/p/FAKE202603004/,Carrossel,,Total,7765,4564,467,51,0,9,156
FAKE202603005,17841476283103388,setup.english,SetUp - English School,"Leitura em inglês: como treinar sem precisar do dicionário toda hora.",,03/03/2026 09:00,https://www.instagram.com/p/FAKE202603005/,Carrossel,,Total,3518,2855,329,80,0,10,77
FAKE202603006,17841476283103388,setup.english,SetUp - English School,"Phrasal verbs que todo profissional precisa saber — lista com exemplos reais.",,03/15/2026 15:00,https://www.instagram.com/p/FAKE202603006/,Reel,,Total,7394,6366,628,112,0,3,173
FAKE202603007,17841476283103388,setup.english,SetUp - English School,"Como funciona a aula particular na SetUp? Personalizamos cada etapa.",,03/14/2026 15:00,https://www.instagram.com/p/FAKE202603007/,Post,,Total,4902,2737,297,63,0,19,80
